{"attestation_required":true,"authoritative":false,"classification":"accepted","comparator_verified":true,"execution":{"command_profile":"official_comparator_systemd_landrun_v1","exit_code":0,"landlock_probe_stderr":{"byte_size":1243,"content_hash":"ae422338feaa38c7b7ff971d958b330d39dfed10c9ae5a82ffcec5ebf7f0717e","path":"landlock-probe.stderr"},"landlock_probe_stdout":{"byte_size":36,"content_hash":"5fbe619866a2f467b57ec2f2d520366e1a9e7f78d1f9b21610eb6e3799780e7e","path":"landlock-probe.stdout"},"network_probe":{"byte_size":2654,"content_hash":"e92d8d98882eed7cc7b66dff9e5676544ca9b91588554dc9ba3bef5d615ffbd9","path":"network-probe.py"},"package_reprojection":{"byte_size":750,"content_hash":"bcbf6c5c3f4bddab04081291c4b6725543e2c097c45bd1aca12aa34c84a75305","path":"package-reprojection.json"},"runner_script":{"byte_size":24864,"content_hash":"87b02bcf85907cf8185477109b9a241eeb6112fdc7404e82cd9bef8571dd3cf4","path":"runner-script.sh"},"stderr":{"byte_size":0,"content_hash":"e3b0c44298fc1c149afbf4c8996fb92427ae41e4649b934ca495991b7852b855","path":"comparator.stderr"},"stdout":{"byte_size":900,"content_hash":"7ce36bb8473633e954e09c13a41b9239cce0514e8eeb7e08bdc819234d28085f","path":"comparator.stdout"},"success_markers":["Building Challenge","Exporting #[MathOS.PilotA.every_prime_other_than_two_is_odd, Nat.add, Nat.sub, Nat.mul, Nat.pow, Nat.gcd, Nat.div, Nat.mod, Nat.beq, Nat.ble, Nat.land, Nat.lor, Nat.xor, Nat.shiftLeft, Nat.shiftRight, String.ofList] from Challenge","Building Solution","Exporting #[MathOS.PilotA.every_prime_other_than_two_is_odd, Nat.add, Nat.sub, Nat.mul, Nat.pow, Nat.gcd, Nat.div, Nat.mod, Nat.beq, Nat.ble, Nat.land, Nat.lor, Nat.xor, Nat.shiftLeft, Nat.shiftRight, String.ofList] from Solution","Running Lean default kernel on solution.","Lean default kernel accepts the solution","Your solution is okay!"],"systemd_properties":{"byte_size":59,"content_hash":"a5946f12de4fa320894114e89fc8e8636eef515ea2ea1786a8e6b879b981b6cf","path":"systemd.properties"},"timed_out":false},"harness":{"challenge_module":"Challenge","files":[{"byte_size":157,"content_hash":"c1b3a2ede8c6f8aad66a6e2a2769d29b057c616c35aa1b82ae887918f86b2889","path":"lake-manifest.json"},{"byte_size":118,"content_hash":"c0dbbee5424e4e1071c5335794281540b329c06344b8a2e32f97fdc789450c4f","path":"lakefile.toml"},{"byte_size":25,"content_hash":"2773c517aa90b66ea8a2c52bddddf84393157797f8341be0df45294fff7fd32e","path":"lean-toolchain"}],"manifest_created_before_solution_copy":true,"no_lake_directory_before_run":true,"no_olean_before_run":true,"project_name":"mathos_comparator_pilot_a","solution_module":"Solution","source_file_count":3},"package":{"declaration_name":"MathOS.PilotA.every_prime_other_than_two_is_odd","input_fingerprint":"653b819298467af7ba34c1eb6e8fb2a440fb6434176a6f67f191b828ec79e41e","lean_toolchain":"leanprover/lean4:v4.32.0","members":[{"byte_size":633,"content_hash":"26e323f12d8211d2965626a9acb5e1e7943c4f774b029bd0793468f2ef70a4d6","path":"package/Challenge.lean"},{"byte_size":1421,"content_hash":"aa1476702fa9b4b66c8fa04048a1282e7fc035704f64424ca2a2bd998b13dee1","path":"package/Solution.lean"},{"byte_size":173,"content_hash":"e1c92e4902dd88715ac2872616c5ee3befaed093725d5fda43e5dcbcf2bd20e1","path":"package/config.json"},{"byte_size":1698,"content_hash":"31f7b1633d9bfe3d6c510f7778dce41c274d088812930bb0c302923be87eb437","path":"package/formalization.yaml"},{"byte_size":2170,"content_hash":"7a3adfa8e30085cbda8ca240ab8288909a088d7ae0f9880ba0cc5b410645cc52","path":"package/verification.json"}],"plan_hash":"0995f09be09a3d0c2031d4e217704197aaeaed5d88816fbc395de7330f8d78e4","source_formalization":{"object_id":"019f88a3-60ba-7ae2-bf62-b1e7dcc89d01","version_hash":"002c8b097aa3058bde6e0dba94aea9337d46466b1dc409f7e2bcb31a3f4fc5c0"},"source_release_manifest_hash":"cc9a281653d74e33e2e95a0620dd5d05b5b79ab108a18b1e93810da63610b632","verification_hash":"7a3adfa8e30085cbda8ca240ab8288909a088d7ae0f9880ba0cc5b410645cc52"},"predicates":{"axioms_verified":true,"fresh_harness_verified":true,"landlock_strict_probe_passed":true,"lean_kernel_verified":true,"network_isolation_verified":true,"non_root_verified":true,"output_bounds_verified":true,"package_reprojected":true,"statement_match_verified":true,"success_markers_ordered_unique":true,"systemd_controls_verified":true,"tool_sources_and_binaries_verified":true,"unexpected_stderr_absent":true},"sandbox":{"comparator_best_effort_after_strict_probe":true,"fake_landrun":false,"landlock_abi":5,"network_isolated":true,"no_new_privileges":true,"non_root":true,"real_landrun":true,"restrict_address_families":"~AF_UNIX","strict_probe_without_best_effort":true,"systemd_user_manager":true,"tcp_network_denied":true,"unix_socket_denied":true},"schema_version":"comparator_run_report/1","tools":[{"binary":{"byte_size":118591264,"content_hash":"725f0e5d60210ea9f3f17347ed774391faf203300373508d392e02006c0b2be5","path":"comparator.bin"},"build_toolchain":"leanprover/lean4:v4.32.0","commit":"68a064109f01c08f47c8edc9f51d6a2bbffaa188","name":"comparator","repository":"https://github.com/leanprover/comparator","source_tree":"0bb408593d6e5f625db53b3be16e3f1cc91a7524"},{"binary":{"byte_size":226545816,"content_hash":"e57369980b0b81228580ce08066fb9bd738e717e002673a143f4956d217266b0","path":"lean4export.bin"},"build_toolchain":"leanprover/lean4:v4.32.0","commit":"af5aa64bb914c3c2c781f378088dbd38acf4f804","name":"lean4export","repository":"https://github.com/leanprover/lean4export","source_tree":"5058a7945d24656600ca05917e3c8c174485bcf5"},{"binary":{"byte_size":6370864,"content_hash":"dc7f0319f01f06ecf26206bf93894e230ef730725dc50c432ef6f29121308499","path":"landrun.bin"},"build_toolchain":"go version go1.24.2 linux/amd64","commit":"5ed4a3db3a4ad930d577215c6b9abaa19df7f99f","name":"landrun","repository":"https://github.com/Zouuup/landrun","source_tree":"890013a5099a92792cbacd2cfff91af3f13cec9c"}],"workflow":{"github_hosted":true,"job":"comparator","kernel_release":"6.17.0-1020-azure","protected_ref":true,"repository":"Mnehmos/MathOS","repository_id":"1305399818","run_attempt":1,"run_id":"29898749807","runner_arch":"X64","runner_image":"ubuntu24","runner_os":"Linux","runner_uid":1001,"source_commit_sha":"3a75ddc8bc5de685dc6425d6158791553be0ca40","source_ref":"refs/heads/main","source_tree_sha":"2790160605ce48eff1da6f4667df5d8966ddc34d","systemd_version":"systemd 255 (255.4-1ubuntu8.16)","workflow_path":".github/workflows/publication.yml","workflow_ref":"Mnehmos/MathOS/.github/workflows/publication.yml@refs/heads/main"}}
